{"artifact_type":"PRE_ACTION_DECISION","protocol_version":"portable_mira.coordination.v0.1","decision_id":"PRE-MIRA-CODEX-DOGFOOD-001-REVISION-1","work_contract_id":"MIRA-CODEX-DOGFOOD-001-REVISION-REPLAY","work_contract_canonical_content_sha256":"3ebe1eef2aac7af7a978f4bf0d32a88980608cb565f4d6bdd0964bbd9a48029d","authorization_ref":null,"validator_id":"portable_mira.coordination.validator.v0.1","decision":"AUTHORIZED","action_class":"CLASS_0_READ_ANALYZE","requested_action":{"action_id":"inspect-repository-content","action_class":"CLASS_0_READ_ANALYZE","operation":"read_repository_content","provider":null,"access_mode":"CONTENT_READ","paths":["experimental/portable_mira_v0.1"],"resources":["git:diff","git:history"]},"access_mode":"CONTENT_READ","baseline_validation":"PASS","scope_validation":"PASS","authorization_validation":"NOT_REQUIRED","budget_validation":"NOT_REQUIRED","diagnostics":["LOCAL_PRE_ACTION_GATE_PASS","VALIDATION_ONLY_NO_ACTION_EXECUTED"],"decision_timestamp_or_sequence":1,"action_executed":false,"self_hash_rule":"NO_SELF_REFERENTIAL_FILE_HASH"}
